{
  "schema": 1,
  "built_at": "2026-10-21T13:17:21+00:00",
  "plugins": [
    {
      "id": "classification-kit",
      "source": "git",
      "location": "https://github.com/vicentzamoras/dashai-classification-kit",
      "name": "Classification Kit",
      "description": "A tabular classification task with its own loader, baseline model and metric.",
      "authors": [
        {
          "name": "Vicente Zamora",
          "email": "",
          "url": "https://github.com/vicentzamoras"
        }
      ],
      "components": [
        "KitTabularClassificationTask",
        "KitCSVDataLoader",
        "KitDummyClassifier",
        "KitAccuracy"
      ],
      "component_types": [
        "Task",
        "DataLoader",
        "Model",
        "Metric"
      ],
      "project_urls": {
        "Homepage": "https://github.com/vicentzamoras/dashai-classification-kit",
        "Issues": "https://github.com/vicentzamoras/dashai-classification-kit/issues"
      },
      "license": "MIT",
      "releases": [
        {
          "tag": "v1.0.0",
          "version": "1.0.0",
          "min_app_version": "0.10.0",
          "sha256": "a3237add4214ee14863f633ba476ff70918eb4165735e7660943f7910adc6c2a",
          "trust_level": "github_source",
          "commit": "4949553973376e659a69479ea2cb64355d79e7a4",
          "published_at": "2026-10-08T15:20:17Z",
          "dependencies": []
        }
      ]
    },
    {
      "id": "echo-chat",
      "source": "git",
      "location": "https://github.com/vicentzamoras/echo-chat",
      "name": "Echo Chat",
      "description": "A chat model that echoes your message, or tells a joke with /joke.",
      "authors": [
        {
          "name": "Vicente Zamora",
          "email": "",
          "url": "https://github.com/vicentzamoras"
        }
      ],
      "components": [
        "EchoChatTask",
        "EchoModel"
      ],
      "component_types": [
        "GenerativeTask",
        "GenerativeModel"
      ],
      "project_urls": {
        "Homepage": "https://github.com/vicentzamoras/echo-chat",
        "Issues": "https://github.com/vicentzamoras/echo-chat/issues"
      },
      "license": "MIT",
      "releases": [
        {
          "tag": "v1.0.1",
          "version": "1.0.1",
          "min_app_version": "0.10.0",
          "sha256": "9ab881d86a5d4aff25de7743013b9ce35660d9ee5984383e77a20079154e0e74",
          "trust_level": "github_attested",
          "workflow": ".github/workflows/release.yaml",
          "signed_at": "2026-10-20T17:48:56+00:00",
          "commit": "2dc2dc3b4afdd6658171be356f384035aee51f8b",
          "published_at": "2026-10-20T17:48:46Z",
          "dependencies": [
            "pyjokes>=0.6"
          ]
        },
        {
          "tag": "v1.0.0",
          "version": "1.0.0",
          "min_app_version": "0.10.0",
          "sha256": "cbe257c6d3c0eee95bd2c552d0f085306e25898f655728e247f1f2d5d2b7f32a",
          "trust_level": "github_asset",
          "commit": "796272d90f3eeacd37b001b3242e30141e6e28c1",
          "published_at": "2026-10-08T15:18:21Z",
          "dependencies": [
            "pyjokes>=0.6"
          ]
        }
      ]
    },
    {
      "id": "explainers-plus",
      "source": "git",
      "location": "https://github.com/centzlostres/explainers-plus",
      "name": "Explainers Plus",
      "description": "Global and local explanations for tabular classifiers.",
      "authors": [
        {
          "name": "John Doe",
          "email": "",
          "url": "https://github.com/centzlostres"
        }
      ],
      "components": [
        "PermutationImportancePlus",
        "KernelShapPlus"
      ],
      "component_types": [
        "GlobalExplainer",
        "LocalExplainer"
      ],
      "project_urls": {
        "Homepage": "https://github.com/centzlostres/explainers-plus",
        "Issues": "https://github.com/centzlostres/explainers-plus/issues"
      },
      "license": "MIT",
      "releases": [
        {
          "tag": "v1.0.0",
          "version": "1.0.0",
          "min_app_version": "0.10.0",
          "sha256": "f7926b568b494aee98c3876cc62122f862096daeae53046077c3c2b2c2f24d68",
          "trust_level": "github_attested",
          "workflow": ".github/workflows/release.yaml",
          "signed_at": "2026-10-08T16:05:32+00:00",
          "commit": "70caee3f345f88ba77b48cd435032a758ddedcfc",
          "published_at": "2026-10-08T16:05:20Z",
          "dependencies": []
        }
      ]
    },
    {
      "id": "tsv-loader",
      "source": "git",
      "location": "https://github.com/centzlostres/tsv-loader",
      "name": "TSV Loader",
      "description": "Data loader for tab-separated (TSV) tabular files.",
      "authors": [
        {
          "name": "Jane Doe",
          "email": "",
          "url": "https://github.com/centzlostres"
        },
        {
          "name": "Test Author Two",
          "email": "author.two@example.org",
          "url": ""
        },
        {
          "name": "Test Author Three",
          "email": "",
          "url": "https://example.org"
        }
      ],
      "components": [
        "TSVDataLoader"
      ],
      "component_types": [
        "DataLoader"
      ],
      "project_urls": {
        "Homepage": "https://github.com/centzlostres/tsv-loader-test",
        "Issues": "https://github.com/centzlostres/tsv-loader-test/issues"
      },
      "license": "MIT",
      "releases": [
        {
          "tag": "v1.0.2",
          "version": "1.0.2",
          "min_app_version": "0.9.0",
          "sha256": "68cad029acbb06708e5921c496d4f19e5515e8a5cd1f9a9932b7b6a227001617",
          "trust_level": "github_attested",
          "workflow": ".github/workflows/release.yaml",
          "signed_at": "2026-10-20T15:16:11+00:00",
          "commit": "98cff2861490480e500ac0aac639509229ca1656",
          "published_at": "2026-10-20T15:15:56Z",
          "dependencies": []
        },
        {
          "tag": "v1.0.1",
          "version": "1.0.1",
          "min_app_version": "0.9.0",
          "sha256": "1ee265b3ebf2b261608e0185d04e2c5694230305f3e3c6c3b7731adfa20445a4",
          "trust_level": "github_attested",
          "workflow": ".github/workflows/release.yaml",
          "signed_at": "2026-10-20T15:14:32+00:00",
          "commit": "0420eeb0e969ca2aed8d9be7dfab5202fb6270eb",
          "published_at": "2026-10-20T15:14:21Z",
          "dependencies": []
        }
      ]
    }
  ],
  "removed": []
}
